{
  "$schema": "https://json-schema.org/draft/2020-12/schema",
  "$id": "urn:gala:schema:author:2.0.0",
  "title": "Gala author contract",
  "type": "object",
  "required": [
    "schemaId",
    "schemaVersion",
    "id",
    "displayName",
    "biography",
    "links",
    "localized",
    "extensions"
  ],
  "properties": {
    "schemaId": { "const": "urn:gala:schema:author:2.0.0" },
    "schemaVersion": { "const": "2.0.0" },
    "id": { "$ref": "#/$defs/stableId" },
    "displayName": {
      "$ref": "#/$defs/plainText",
      "x-gala-graphemeLength": { "minimum": 1, "maximum": 120 }
    },
    "biography": {
      "$ref": "#/$defs/plainText",
      "x-gala-graphemeLength": { "minimum": 0, "maximum": 2000 }
    },
    "pronouns": {
      "$ref": "#/$defs/plainText",
      "x-gala-graphemeLength": { "minimum": 1, "maximum": 80 }
    },
    "avatarRef": { "$ref": "#/$defs/repoRelativePath" },
    "links": {
      "type": "array",
      "items": { "$ref": "#/$defs/socialLink" },
      "minItems": 0,
      "maxItems": 32
    },
    "localized": {
      "type": "array",
      "items": { "$ref": "#/$defs/localizedAuthor" },
      "minItems": 0,
      "maxItems": 32
    },
    "extensions": { "$ref": "#/$defs/extensionMap" }
  },
  "additionalProperties": false,
  "$defs": {
    "stableId": {
      "type": "string",
      "pattern": "^[0-9a-f]{8}-[0-9a-f]{4}-7[0-9a-f]{3}-[89ab][0-9a-f]{3}-[0-9a-f]{12}$",
      "description": "Lowercase canonical UUIDv7. Once published, it is immutable; its time ordering conveys neither chronology nor authority."
    },
    "slug": {
      "type": "string",
      "minLength": 1,
      "maxLength": 80,
      "pattern": "^[a-z0-9]+(?:-[a-z0-9]+)*$"
    },
    "repoRelativePath": {
      "type": "string",
      "minLength": 1,
      "maxLength": 512,
      "pattern": "^(?!/)(?!.*\\\\)(?!.*\\u0000).+$",
      "format": "gala-repository-relative-path",
      "x-gala-utf8ByteLength": { "maximum": 512 },
      "description": "NFC UTF-8 repository-relative path using slash separators, with no leading slash, dot segment, NUL, backslash, or percent-decoded traversal."
    },
    "canonicalRoute": {
      "type": "string",
      "minLength": 1,
      "pattern": "^/(?!/)(?!.*//)(?!.*[?#]).*$",
      "format": "gala-canonical-route",
      "description": "Absolute normalized route with no query, fragment, dot segment, double slash, or non-normalized percent encoding."
    },
    "gitObjectId": {
      "type": "string",
      "pattern": "^(?:sha1:[0-9a-f]{40}|sha256:[0-9a-f]{64})$"
    },
    "digest": { "type": "string", "pattern": "^sha256:[0-9a-f]{64}$" },
    "urlHttps": {
      "type": "string",
      "format": "uri",
      "pattern": "^https://(?![^/?#]*@)",
      "description": "Absolute HTTPS URL without embedded credentials."
    },
    "bcp47": {
      "type": "string",
      "format": "gala-bcp47",
      "description": "Structurally valid canonical BCP-47 language tag."
    },
    "isoCountry": {
      "type": "string",
      "pattern": "^[A-Z]{2}$",
      "format": "gala-iso-country",
      "description": "ISO 3166-1 alpha-2 country code; admission remains subject to the active policy profile."
    },
    "plainLabel": {
      "type": "string",
      "format": "gala-plain-label",
      "x-gala-graphemeLength": { "minimum": 1, "maximum": 80 },
      "description": "Normalized Unicode plain text without markup, controls, or bidi overrides."
    },
    "plainText": {
      "type": "string",
      "format": "gala-plain-text",
      "description": "NFC Unicode text without disallowed C0/C1 controls or bidi override/isolate controls."
    },
    "rfc3339": {
      "type": "string",
      "format": "date-time",
      "pattern": "^\\d{4}-\\d{2}-\\d{2}T\\d{2}:\\d{2}:\\d{2}\\.\\d{3}Z$"
    },
    "semver": {
      "type": "string",
      "pattern": "^(?:0|[1-9]\\d*)\\.(?:0|[1-9]\\d*)\\.(?:0|[1-9]\\d*)(?:-(?:0|[1-9]\\d*|\\d*[A-Za-z-][0-9A-Za-z-]*)(?:\\.(?:0|[1-9]\\d*|\\d*[A-Za-z-][0-9A-Za-z-]*))*)?$",
      "description": "Canonical SemVer 2.0.0 without build metadata."
    },
    "semverRange": {
      "type": "string",
      "minLength": 1,
      "pattern": "^\\S+$",
      "format": "gala-semver-range",
      "description": "Whitespace-free npm-compatible exact, caret, or bounded comparator-set range; tags and URLs are invalid."
    },
    "packageRange": {
      "type": "string",
      "minLength": 3,
      "pattern": "^(?:@[a-z0-9](?:[a-z0-9._-]*[a-z0-9])?/[a-z0-9](?:[a-z0-9._-]*[a-z0-9])?|[a-z0-9](?:[a-z0-9._-]*[a-z0-9])?)@\\S+$",
      "format": "gala-package-range",
      "description": "Lowercase npm package identity and admitted semver range; Git, file, URL, and alias sources are invalid."
    },
    "packageExact": {
      "type": "string",
      "minLength": 3,
      "pattern": "^(?:@[a-z0-9](?:[a-z0-9._-]*[a-z0-9])?/[a-z0-9](?:[a-z0-9._-]*[a-z0-9])?|[a-z0-9](?:[a-z0-9._-]*[a-z0-9])?)@\\S+$",
      "format": "gala-package-exact",
      "description": "Lowercase npm package identity and exact canonical semantic version; aliases are invalid."
    },
    "urn": {
      "type": "string",
      "minLength": 10,
      "maxLength": 255,
      "format": "uri",
      "pattern": "^urn:gala:[\\x21-\\x7E]+$",
      "description": "Absolute ASCII URN in the schema-declared Gala namespace."
    },
    "glob": {
      "type": "string",
      "minLength": 1,
      "maxLength": 256,
      "format": "gala-repository-glob",
      "x-gala-utf8ByteLength": { "maximum": 256 },
      "description": "Repository-relative POSIX glob using only star, globstar, and question-mark operators; braces, extglobs, negation, absolute paths, and parent traversal are invalid."
    },
    "passiveVisualToken": false,
    "extensionKey": {
      "type": "string",
      "format": "gala-extension-key",
      "description": "Reverse-DNS extension namespace that cannot shadow a core key."
    },
    "socialLink": {
      "type": "object",
      "required": ["type", "uri"],
      "properties": {
        "type": {
          "enum": [
            "website",
            "email",
            "github",
            "linkedin",
            "mastodon",
            "bluesky",
            "x",
            "youtube",
            "other"
          ]
        },
        "uri": { "type": "string", "minLength": 1, "maxLength": 2048 },
        "label": { "$ref": "#/$defs/plainLabel" }
      },
      "additionalProperties": false,
      "allOf": [
        {
          "if": {
            "properties": { "type": { "const": "email" } },
            "required": ["type"]
          },
          "then": {
            "properties": {
              "uri": {
                "type": "string",
                "format": "uri",
                "pattern": "^mailto:"
              }
            }
          },
          "else": { "properties": { "uri": { "$ref": "#/$defs/urlHttps" } } }
        }
      ]
    },
    "localizedAuthor": {
      "type": "object",
      "required": ["language", "displayName", "biography"],
      "properties": {
        "language": { "$ref": "#/$defs/bcp47" },
        "displayName": {
          "$ref": "#/$defs/plainText",
          "x-gala-graphemeLength": { "minimum": 1, "maximum": 120 }
        },
        "biography": {
          "$ref": "#/$defs/plainText",
          "x-gala-graphemeLength": { "minimum": 0, "maximum": 2000 }
        }
      },
      "additionalProperties": false
    },
    "extensionMap": {
      "type": "object",
      "maxProperties": 32,
      "propertyNames": { "$ref": "#/$defs/extensionKey" },
      "additionalProperties": { "x-gala-maxCanonicalBytes": 16384 },
      "x-gala-maxCanonicalBytes": 131072
    }
  }
}
