{
  "schemaId": "urn:gala:schema:author:2.0.0",
  "schemaVersion": "2.0.0",
  "id": "019c0000-0000-7000-8000-000000000001",
  "displayName": "fixture-1",
  "biography": "fixture-1",
  "links": [{ "type": "website", "uri": "https://fixture-1.example.com/" }],
  "localized": [
    {
      "language": "en-US",
      "displayName": "fixture-1",
      "biography": "fixture-1"
    }
  ],
  "extensions": {}
}
